{
  "current_revision": "create-template-json-health-checker-template-pack-20260321t023354z",
  "current_version": "0.1.0",
  "lifecycle_stage": "maintained",
  "pack_id": "json-health-checker-template-pack",
  "pack_kind": "template_pack",
  "promotion_target": "none",
  "schema_version": "pack-lifecycle/v2",
  "state_reason": "The active smoke template should stay a neutral factory workflow baseline, while this new template gives us a more task-shaped quick test pack for JSON input validation.",
  "updated_at": "2026-03-21T02:33:54Z",
  "updated_by": "orchadmin"
}
